source,native,name,p_value,significant,description,term_size,query_size,intersection_size,effective_domain_size,precision,recall,query,parents,intersections,evidences
KEGG,KEGG:00982,Drug metabolism - cytochrome P450,5.620389730324887e-07,True,Drug metabolism - cytochrome P450,71,12,5,10539,0.4166666666666667,0.07042253521126761,query_1,['KEGG:00000'],"['ENSMUSG00000026692', 'ENSMUSG00000090165', 'ENSMUSG00000026691', 'ENSMUSG00000089675', 'ENSMUSG00000040181']","[['KEGG'], ['KEGG'], ['KEGG'], ['KEGG'], ['KEGG']]"
GO:MF,GO:0004499,"N,N-dimethylaniline monooxygenase activity",7.658838406319117e-06,True,"""Catalysis of the reaction: N,N-dimethylaniline + NADPH + H+ + O2 = N,N-dimethylaniline N-oxide + NADP+ + H2O."" [RHEA:24468]",9,18,3,23512,0.16666666666666666,0.3333333333333333,query_1,['GO:0016709'],"['ENSMUSG00000026692', 'ENSMUSG00000026691', 'ENSMUSG00000040181']","[['IEA'], ['IEA'], ['IEA']]"
GO:MF,GO:0047822,hypotaurine monooxygenase activity,7.658838406319117e-06,True,"""Catalysis of the reaction: H+ + hypotaurine + NADPH + O2 = H2O + NADP+ + taurine."" [RHEA:69819]",9,18,3,23512,0.16666666666666666,0.3333333333333333,query_1,['GO:0016709'],"['ENSMUSG00000026692', 'ENSMUSG00000026691', 'ENSMUSG00000040181']","[['IEA'], ['IEA'], ['IMP', 'IEA']]"
GO:MF,GO:0050660,flavin adenine dinucleotide binding,9.356814096091094e-05,True,"""Binding to FAD, flavin-adenine dinucleotide, the coenzyme or the prosthetic group of various flavoprotein oxidoreductase enzymes, in either the oxidized form, FAD, or the reduced form, FADH2."" [GOC:ai, GOC:imk, ISBN:0198506732]",81,18,4,23512,0.2222222222222222,0.04938271604938271,query_1,"['GO:0000166', 'GO:0043168']","['ENSMUSG00000026692', 'ENSMUSG00000026691', 'ENSMUSG00000034926', 'ENSMUSG00000040181']","[['IEA'], ['IEA'], ['IEA'], ['IEA']]"
KEGG,KEGG:00430,Taurine and hypotaurine metabolism,0.00010502151478020496,True,Taurine and hypotaurine metabolism,22,12,3,10539,0.25,0.13636363636363635,query_1,['KEGG:00000'],"['ENSMUSG00000026692', 'ENSMUSG00000026691', 'ENSMUSG00000040181']","[['KEGG'], ['KEGG'], ['KEGG']]"
GO:BP,GO:0006790,sulfur compound metabolic process,0.00019037937471750904,True,"""The chemical reactions and pathways involving the nonmetallic element sulfur or compounds that contain sulfur, such as the amino acids methionine and cysteine or the tripeptide glutathione."" [GOC:ai]",224,15,5,24936,0.3333333333333333,0.022321428571428572,query_1,['GO:0008152'],"['ENSMUSG00000021228', 'ENSMUSG00000052392', 'ENSMUSG00000026691', 'ENSMUSG00000037370', 'ENSMUSG00000040181']","[['IDA', 'IEA'], ['IDA', 'IEA'], ['IEA'], ['IEA'], ['IMP', 'IEA']]"
GO:MF,GO:0016709,"oxidoreductase activity, acting on paired donors, with incorporation or reduction of molecular oxygen, NAD(P)H as one donor, and incorporation of one atom of oxygen",0.0002644037385760953,True,"""Catalysis of an oxidation-reduction (redox) reaction in which hydrogen or electrons are transferred from NADH or NADPH and one other donor, and one atom of oxygen is incorporated into one donor."" [EC:1.14.13.-]",27,18,3,23512,0.16666666666666666,0.1111111111111111,query_1,"['GO:0004497', 'GO:0016705']","['ENSMUSG00000026692', 'ENSMUSG00000026691', 'ENSMUSG00000040181']","[['IEA'], ['IEA'], ['IMP', 'ISS', 'IEA']]"
GO:MF,GO:0034899,trimethylamine monooxygenase activity,0.0004028911272686479,True,"""Catalysis of the reaction: N,N,N-trimethylamine + NADPH + H+ + O2 = N,N,N-trimethylamine N-oxide + NADP+ + H2O."" [EC:1.14.13.148, UM-BBD_reactionID:r1407]",3,18,2,23512,0.1111111111111111,0.6666666666666666,query_1,['GO:0016709'],"['ENSMUSG00000026691', 'ENSMUSG00000040181']","[['IEA'], ['ISS', 'IEA']]"
KEGG,KEGG:01100,Metabolic pathways,0.0004653409623754106,True,Metabolic pathways,1646,12,9,10539,0.75,0.0054678007290400975,query_1,['KEGG:00000'],"['ENSMUSG00000021228', 'ENSMUSG00000026692', 'ENSMUSG00000090165', 'ENSMUSG00000052392', 'ENSMUSG00000026691', 'ENSMUSG00000034926', 'ENSMUSG00000037370', 'ENSMUSG00000089675', 'ENSMUSG00000040181']","[['KEGG'], ['KEGG'], ['KEGG'], ['KEGG'], ['KEGG'], ['KEGG'], ['KEGG'], ['KEGG'], ['KEGG']]"
REAC,REAC:R-MMU-217271,FMO oxidises nucleophiles,0.0007954803061890353,True,FMO oxidises nucleophiles,3,10,2,8514,0.2,0.6666666666666666,query_1,['REAC:R-MMU-211945'],"['ENSMUSG00000026691', 'ENSMUSG00000040181']","[['REAC'], ['REAC']]"
GO:BP,GO:0032789,unsaturated monocarboxylic acid metabolic process,0.00123520646214766,True,"""The chemical reactions and pathways involving unsaturated monocarboxylic acids, any organic acid containing one carboxyl (COOH) group or anion (COO-) and one or more unsaturated C-C bonds."" [GOC:mah, GOC:vk]",3,15,2,24936,0.13333333333333333,0.6666666666666666,query_1,['GO:0032787'],"['ENSMUSG00000021228', 'ENSMUSG00000052392']","[['IDA'], ['IEA']]"
GO:BP,GO:0032788,saturated monocarboxylic acid metabolic process,0.00123520646214766,True,"""The chemical reactions and pathways involving saturated monocarboxylic acids, any organic acid containing one carboxyl (COOH) group or anion (COO-) and fully saturated C-C bonds."" [GOC:mah, GOC:vk]",3,15,2,24936,0.13333333333333333,0.6666666666666666,query_1,['GO:0019752'],"['ENSMUSG00000021228', 'ENSMUSG00000052392']","[['IDA'], ['IEA']]"
GO:MF,GO:0050661,NADP binding,0.002091388249851004,True,"""Binding to nicotinamide-adenine dinucleotide phosphate, a coenzyme involved in many redox and biosynthetic reactions; binding may be to either the oxidized form, NADP+, or the reduced form, NADPH."" [GOC:ai]",53,18,3,23512,0.16666666666666666,0.05660377358490566,query_1,['GO:0030554'],"['ENSMUSG00000026692', 'ENSMUSG00000026691', 'ENSMUSG00000040181']","[['IEA'], ['IEA'], ['IEA']]"
GO:BP,GO:0042412,taurine biosynthetic process,0.0024695542590707827,True,"""The chemical reactions and pathways resulting in the formation of taurine (2-aminoethanesulfonic acid), a sulphur-containing amino acid derivative important in the metabolism of fats."" [GOC:jl, ISBN:0198600461]",4,15,2,24936,0.13333333333333333,0.5,query_1,"['GO:0019530', 'GO:0046305']","['ENSMUSG00000026691', 'ENSMUSG00000040181']","[['IEA'], ['IMP', 'IEA']]"
GO:BP,GO:0046305,alkanesulfonate biosynthetic process,0.0024695542590707827,True,"""The chemical reactions and pathways resulting in the formation of alkanesulfonates, the anion of alkanesulfonic acids, sulfonic acid derivatives containing an aliphatic hydrocarbon group."" [GOC:ai]",4,15,2,24936,0.13333333333333333,0.5,query_1,"['GO:0016053', 'GO:0019694', 'GO:0044272']","['ENSMUSG00000026691', 'ENSMUSG00000040181']","[['IEA'], ['IMP', 'IEA']]"
WP,WP:WP1251,Metapathway biotransformation,0.0038459494764368613,True,Metapathway biotransformation,140,10,4,4801,0.4,0.02857142857142857,query_1,['WP:000000'],"['ENSMUSG00000026692', 'ENSMUSG00000090165', 'ENSMUSG00000026691', 'ENSMUSG00000040181']","[['WP'], ['WP'], ['WP'], ['WP']]"
GO:BP,GO:0006082,organic acid metabolic process,0.004705944290139616,True,"""The chemical reactions and pathways involving organic acids, any acidic compound containing carbon in covalent linkage."" [ISBN:0198506732]",789,15,6,24936,0.4,0.0076045627376425855,query_1,['GO:0044281'],"['ENSMUSG00000021228', 'ENSMUSG00000026692', 'ENSMUSG00000052392', 'ENSMUSG00000026691', 'ENSMUSG00000037370', 'ENSMUSG00000040181']","[['IDA', 'IEA'], ['IGI'], ['IDA', 'IEA'], ['IEA'], ['IEA'], ['IMP', 'IGI', 'IEA']]"
GO:CC,GO:0005789,endoplasmic reticulum membrane,0.00934047490990401,True,"""The lipid bilayer surrounding the endoplasmic reticulum."" [GOC:mah]",1104,18,6,25413,0.3333333333333333,0.005434782608695652,query_1,"['GO:0031090', 'GO:0042175', 'GO:0098827']","['ENSMUSG00000026692', 'ENSMUSG00000090165', 'ENSMUSG00000026691', 'ENSMUSG00000034926', 'ENSMUSG00000089675', 'ENSMUSG00000040181']","[['IEA'], ['IEA'], ['IEA'], ['IEA'], ['IEA'], ['ISS', 'IEA']]"
GO:CC,GO:0098827,endoplasmic reticulum subcompartment,0.00952995555212444,True,"""A distinct region of the endoplasmic reticulum."" [GOC:dos]",1108,18,6,25413,0.3333333333333333,0.005415162454873646,query_1,"['GO:0005783', 'GO:0031984']","['ENSMUSG00000026692', 'ENSMUSG00000090165', 'ENSMUSG00000026691', 'ENSMUSG00000034926', 'ENSMUSG00000089675', 'ENSMUSG00000040181']","[['IEA'], ['IEA'], ['IEA'], ['IEA'], ['IEA'], ['ISS', 'IEA']]"
GO:CC,GO:0042175,nuclear outer membrane-endoplasmic reticulum membrane network,0.010268229573827769,True,"""The continuous network of membranes encompassing the nuclear outer membrane and the endoplasmic reticulum membrane."" [GOC:bf, GOC:jl, GOC:mah, GOC:mcc, GOC:pr, GOC:vw]",1123,18,6,25413,0.3333333333333333,0.005342831700801425,query_1,"['GO:0012505', 'GO:0016020']","['ENSMUSG00000026692', 'ENSMUSG00000090165', 'ENSMUSG00000026691', 'ENSMUSG00000034926', 'ENSMUSG00000089675', 'ENSMUSG00000040181']","[['IEA'], ['IEA'], ['IEA'], ['IEA'], ['IEA'], ['ISS', 'IEA']]"
WP,WP:WP1241,Glucuronidation,0.01582886980594377,True,Glucuronidation,17,10,2,4801,0.2,0.11764705882352941,query_1,['WP:000000'],"['ENSMUSG00000090165', 'ENSMUSG00000089675']","[['WP'], ['WP']]"
GO:BP,GO:0044281,small molecule metabolic process,0.017744816676109727,True,"""The chemical reactions and pathways involving small molecules, any low molecular weight, monomeric, non-encoded molecule."" [GOC:curators, GOC:pde, GOC:vw]",1549,15,7,24936,0.4666666666666667,0.004519044544867657,query_1,['GO:0008152'],"['ENSMUSG00000021228', 'ENSMUSG00000026692', 'ENSMUSG00000052392', 'ENSMUSG00000026691', 'ENSMUSG00000034926', 'ENSMUSG00000037370', 'ENSMUSG00000040181']","[['IDA', 'IEA'], ['IGI'], ['IDA', 'IEA'], ['IEA'], ['IMP', 'ISO', 'IEA'], ['IEA'], ['IMP', 'IGI', 'IEA']]"
GO:BP,GO:0019530,taurine metabolic process,0.01848306579675703,True,"""The chemical reactions and pathways involving taurine (2-aminoethanesulfonic acid), a sulphur-containing amino acid derivative important in the metabolism of fats."" [GOC:jl, ISBN:0198600461]",10,15,2,24936,0.13333333333333333,0.2,query_1,['GO:0019694'],"['ENSMUSG00000026691', 'ENSMUSG00000040181']","[['IEA'], ['IMP', 'IEA']]"
GO:BP,GO:0019694,alkanesulfonate metabolic process,0.01848306579675703,True,"""The chemical reactions and pathways involving alkanesulfonates, the anion of alkanesulfonic acids, sulfonic acid derivatives containing an aliphatic hydrocarbon group."" [GOC:ai]",10,15,2,24936,0.13333333333333333,0.2,query_1,"['GO:0006082', 'GO:0006790']","['ENSMUSG00000026691', 'ENSMUSG00000040181']","[['IEA'], ['IMP', 'IEA']]"
GO:CC,GO:0031984,organelle subcompartment,0.027237970384782022,True,"""A compartment that consists of a lumen and an enclosing membrane, and is part of an organelle."" [GOC:mah, GOC:pz]",1341,18,6,25413,0.3333333333333333,0.0044742729306487695,query_1,"['GO:0043227', 'GO:0043229', 'GO:0110165']","['ENSMUSG00000026692', 'ENSMUSG00000090165', 'ENSMUSG00000026691', 'ENSMUSG00000034926', 'ENSMUSG00000089675', 'ENSMUSG00000040181']","[['IEA'], ['IEA'], ['IEA'], ['IEA'], ['IEA'], ['ISS', 'IEA']]"
KEGG,KEGG:00062,Fatty acid elongation,0.031085529908545236,True,Fatty acid elongation,30,12,2,10539,0.16666666666666666,0.06666666666666667,query_1,['KEGG:00000'],"['ENSMUSG00000021228', 'ENSMUSG00000052392']","[['KEGG'], ['KEGG']]"
KEGG,KEGG:00053,Ascorbate and aldarate metabolism,0.03539982399966479,True,Ascorbate and aldarate metabolism,32,12,2,10539,0.16666666666666666,0.0625,query_1,['KEGG:00000'],"['ENSMUSG00000090165', 'ENSMUSG00000089675']","[['KEGG'], ['KEGG']]"
GO:BP,GO:0046322,negative regulation of fatty acid oxidation,0.037324933648738914,True,"""Any process that stops, prevents, or reduces the frequency, rate or extent of fatty acid oxidation."" [GOC:ai]",14,15,2,24936,0.13333333333333333,0.14285714285714285,query_1,"['GO:0019395', 'GO:0045922', 'GO:0046320']","['ENSMUSG00000026692', 'ENSMUSG00000040181']","[['IGI'], ['IGI']]"
KEGG,KEGG:01040,Biosynthesis of unsaturated fatty acids,0.039988278248020065,True,Biosynthesis of unsaturated fatty acids,34,12,2,10539,0.16666666666666666,0.058823529411764705,query_1,['KEGG:00000'],"['ENSMUSG00000021228', 'ENSMUSG00000052392']","[['KEGG'], ['KEGG']]"
GO:MF,GO:0047617,fatty acyl-CoA hydrolase activity,0.043193475936425245,True,"""Catalysis of the reaction: a fatty acyl-CoA + H2O = a fatty acid + CoA + H+."" [RHEA:16781]",26,18,2,23512,0.1111111111111111,0.07692307692307693,query_1,['GO:0016289'],"['ENSMUSG00000021228', 'ENSMUSG00000052392']","[['IDA', 'TAS'], ['IDA', 'TAS', 'IEA']]"
KEGG,KEGG:00040,Pentose and glucuronate interconversions,0.04484983204593992,True,Pentose and glucuronate interconversions,36,12,2,10539,0.16666666666666666,0.05555555555555555,query_1,['KEGG:00000'],"['ENSMUSG00000090165', 'ENSMUSG00000089675']","[['KEGG'], ['KEGG']]"
GO:MF,GO:0016289,acyl-CoA hydrolase activity,0.04662780171225331,True,"""Catalysis of the reaction: an acyl-CoA + H2O = a carboxylate + CoA + H+."" [RHEA:70423]",27,18,2,23512,0.1111111111111111,0.07407407407407407,query_1,"['GO:0016790', 'GO:0160215']","['ENSMUSG00000021228', 'ENSMUSG00000052392']","[['IDA', 'TAS'], ['IDA', 'TAS', 'IEA']]"
GO:MF,GO:0004497,monooxygenase activity,0.048855520406264,True,"""Catalysis of the incorporation of one atom of molecular oxygen (O2) into the substrate and the reduction of the other atom of O2 to water."" [PMID:1444267]",152,18,3,23512,0.16666666666666666,0.019736842105263157,query_1,['GO:0016491'],"['ENSMUSG00000026692', 'ENSMUSG00000026691', 'ENSMUSG00000040181']","[['IEA'], ['IEA'], ['IMP', 'ISS', 'ISO', 'IEA']]"
HP,HP:0010639,Elevated alkaline phosphatase of bone origin,0.04976109053552752,True,"An abnormally increased level of bone isoforms of alkaline phosphatase, tissue-nonspecific isozyme in the blood.",13,5,2,5328,0.4,0.15384615384615385,query_1,['HP:0010679'],"['ENSMUSG00000019768', 'ENSMUSG00000037370']","[['HP'], ['HP']]"
